{
  "$schema": "http://json-schema.org/draft-07/schema#",
  "title": "DynamodbTimeWindowEvent",
  "type": "object",
  "properties": {
    "Records": {
      "type": "array",
      "items": {
        "type": "object",
        "additionalProperties": true
      }
    },
    "window": {
      "type": "object",
      "additionalProperties": true
    },
    "state": {
      "type": "object",
      "additionalProperties": true
    },
    "shardId": {
      "type": "string"
    },
    "eventSourceARN": {
      "type": "string"
    },
    "isFinalInvokeForWindow": {
      "type": "boolean"
    },
    "isWindowTerminatedEarly": {
      "type": "boolean"
    }
  },
  "additionalProperties": false
}